{
  "catalog_version": "infergrade_runtime_trust_catalog_v1",
  "root_key_ids": [
    "root-1",
    "root-2"
  ],
  "signing_environment": "review_candidate",
  "targets": [
    {
      "archive_sha256": "022469e0b22f4b84dcd0a323867d7f5a31dae21894931ee6a24a35abd2a60359",
      "compatibility_status": "exact_artifact_standard_depth_validated",
      "content_manifest_sha256": "2dae0e1a9486f2b8ad98bcf4d57f71a36e8f95ce7144da8476ba3b6d4d88987c",
      "maturity": "reviewed_candidate",
      "origin": "upstream_official",
      "provenance_strength": "checksum_verified",
      "publisher": "infergrade",
      "revocation_reason": null,
      "revoked": false,
      "runtime_build_id": "b57a9b1cde1365fe7714081da036402dcdb5b86ec5595e45e1cde49b701ef9a5",
      "runtime_family": "llama.cpp",
      "runtime_interface": "llama_cpp_cli_server_v1",
      "support_tier": "candidate",
      "target_name": "infergrade/llama-cpp/b10069/macos-arm64.tar.gz",
      "validation_assertions": [
        {
          "assertion_id": "minicpm5-1b-q4-k-m-standard-20260721",
          "benchmark_depth": "standard",
          "bundle_id": "qb_20260721_022016_9966df7f",
          "model_artifact_sha256": "81b64d05a23b17b34c475f42b3e72fbde62d4b92cc34541f7a8031d0752deafa",
          "model_id": "openbmb/MiniCPM5-1B-GGUF",
          "model_revision": "87007042419d30c1d8f38ef065424ee33870831e",
          "published": false,
          "quantization_label": "Q4_K_M",
          "result_status": "valid_comparable"
        },
        {
          "assertion_id": "gemma4-e4b-q4-0-standard-20260721",
          "benchmark_depth": "standard",
          "bundle_id": "qb_20260721_022953_0d4ae607",
          "model_artifact_sha256": "e8b6a059ba86947a44ace84d6e5679795bc41862c25c30513142588f0e9dba1d",
          "model_id": "google/gemma-4-E4B-it-qat-q4_0-gguf",
          "model_revision": "7edc6763a77bbca236126a361613b834c5ea0f7a",
          "published": false,
          "quantization_label": "Q4_0",
          "result_status": "valid_comparable"
        }
      ]
    }
  ],
  "targets_metadata_sha256": "144032414dd4655ce0b0277274473b7bad5311ae1f989b5dbbfb3e0770d3aaa5",
  "targets_metadata_version": 6
}
